{
  "contract": 1,
  "format": "x509",
  "observation": {
    "at": "2026-09-15T14:02:11Z",
    "source": {
      "kind": "host",
      "ref": "api.example.com:443",
      "servername": "api.example.com"
    }
  },
  "target": 0,
  "certificates": [
    {
      "index": 0,
      "kind": "end-entity",
      "selfSigned": false,
      "issuedBy": [
        1
      ],
      "subject": {
        "cn": "api.example.com",
        "dn": "CN=api.example.com"
      },
      "issuer": {
        "cn": "Example Issuing CA 1",
        "dn": "C=US, O=Example Trust, CN=Example Issuing CA 1"
      },
      "serial": "AA584DEEFA2F58F4AD042288F149DD4C",
      "notBefore": "2026-08-01T00:00:00Z",
      "notAfter": "2026-10-30T00:00:00Z",
      "san": {
        "dns": [
          "api.example.com",
          "www.example.com"
        ],
        "ip": [],
        "email": [],
        "uri": []
      },
      "eku": [
        "serverAuth"
      ],
      "key": {
        "algorithm": "ec",
        "size": 256,
        "curve": "P-256"
      },
      "sha256": "872a229969048f8dffb599a463b6438a35aa16c6eba1922db552e8560bccd508",
      "spkiSha256": "d0c79a95047112b0e0e0c54cbe30e91b6d850cc0dea4f94543ad5ff9448d51bd",
      "derived": {
        "daysRemaining": 44.4,
        "lifetimeFraction": 0.51
      }
    },
    {
      "index": 1,
      "kind": "ca",
      "selfSigned": false,
      "issuedBy": [],
      "subject": {
        "cn": "Example Issuing CA 1",
        "dn": "C=US, O=Example Trust, CN=Example Issuing CA 1"
      },
      "issuer": {
        "cn": "Example Root CA",
        "dn": "C=US, O=Example Trust, CN=Example Root CA"
      },
      "serial": "8EEF33269BB1958043239FE8636AA688",
      "notBefore": "2024-03-13T00:00:00Z",
      "notAfter": "2027-03-12T23:59:59Z",
      "san": {
        "dns": [],
        "ip": [],
        "email": [],
        "uri": []
      },
      "eku": [
        "clientAuth",
        "serverAuth"
      ],
      "key": {
        "algorithm": "rsa",
        "size": 2048,
        "curve": null
      },
      "sha256": "8e10e535f20540324a29d812b4101da63eae2277782f748a8cc4961daffc160b",
      "spkiSha256": "8d9025f5e5f01ef4262114752ad51533bab89aa93ae63c4a910b09cbb94bbc23",
      "derived": {
        "daysRemaining": 178.4,
        "lifetimeFraction": 0.84
      }
    }
  ],
  "warnings": []
}
