{
  "contract": 1,
  "format": "x509",
  "observation": {
    "at": "2026-09-15T14:02:11Z",
    "source": {
      "kind": "file",
      "ref": "ca-san-twice.crt"
    }
  },
  "target": 0,
  "certificates": [
    {
      "index": 0,
      "kind": "end-entity",
      "selfSigned": false,
      "issuedBy": [],
      "subject": {
        "cn": "san-twice",
        "dn": "CN=san-twice"
      },
      "issuer": {
        "cn": "san-twice",
        "dn": "CN=san-twice"
      },
      "serial": "05",
      "notBefore": "2026-01-01T00:00:00Z",
      "notAfter": "2036-01-01T00:00:00Z",
      "san": {
        "dns": [
          "a.example"
        ],
        "ip": [],
        "email": [],
        "uri": []
      },
      "eku": null,
      "key": {
        "algorithm": "ec",
        "size": 256,
        "curve": "P-256"
      },
      "sha256": "344f7876b82d31199dbc628d0230677ee512abdb6e3d83d28fd837947fe70d29",
      "spkiSha256": "42cf263fc1ac2efce2a1c61c25158a13f3fe0e2c17d8c68e2790e7fbf3df5035",
      "derived": {
        "daysRemaining": 3394.4,
        "lifetimeFraction": 0.07
      }
    }
  ],
  "warnings": [
    {
      "code": "KIND_UNRELIABLE",
      "certificate": 0,
      "message": "kind cannot be trusted: Node.js reads the certificate as end-entity, and its basicConstraints and Key Usage make it a CA"
    }
  ]
}
